<!ELEMENT students (student+)>
<!ELEMENT student (name, age, mark?)>
<!ATTLIST student rollno CDATA #REQUIRED>
<!ELEMENT name (#PCDATA)>
<!ELEMENT age (#PCDATA)>
<!ELEMENT mark (#PCDATA)>